{
  "artifactCount": 6,
  "artifacts": [
    {
      "bytes": 12478,
      "contentType": "text/mermaid",
      "path": "rendered/ecosystem-registry-map.mmd",
      "role": "canonical_ecosystem_map_mermaid",
      "sha256": "ce81320114ff12161a0a2644d67b3bca8a193d4c37d780760adfc68ef3f3f890"
    },
    {
      "bytes": 46759,
      "contentType": "text/markdown",
      "path": "rendered/system-catalog.md",
      "role": "rendered_catalog_markdown",
      "sha256": "ec4e85a8ea0a7aa24fb170ab885a9a5dc84375b12414e457ab9190783068b543"
    },
    {
      "bytes": 33321,
      "contentType": "application/json",
      "path": "registry/ecosystem/nodes.json",
      "role": "registry_nodes",
      "sha256": "b2a9e7a0c81c57b7948c15c82a5557a19aef096804972af131b29787450b303c"
    },
    {
      "bytes": 11413,
      "contentType": "application/json",
      "path": "registry/ecosystem/edges.json",
      "role": "registry_edges",
      "sha256": "275238106dcf9b9e7d9bdde732efd3f9a8b14d081cffabcd2bc0a10e7a730f7c"
    },
    {
      "bytes": 3431,
      "contentType": "application/json",
      "path": "registry/ecosystem/authority-matrix.v1.json",
      "role": "authority_matrix",
      "sha256": "af6c0dc0d788a7edf98e3904993f5ef1825f2ea88ac2fab3e5a464707a2d5202"
    },
    {
      "bytes": 37962,
      "contentType": "application/json",
      "path": "registry/ecosystem/resilience.v1.json",
      "role": "resilience_semantics",
      "sha256": "0ddb2ce554df14bf52a910a6efd63b8416bc569280ff9c9991a3fd010d507af0"
    }
  ],
  "contractVersion": "1",
  "doesNotEstablish": [
    "claim_truth",
    "runtime_correctness",
    "merge_readiness",
    "system_catalog_registry_correctness",
    "consumer_view_correctness",
    "render_success_validates_map"
  ],
  "kind": "system_catalog_map_artifact_manifest",
  "mode": "read_only_projection_source",
  "schemaPath": "catalog/ecosystem-map-artifact-manifest.schema.v1.json",
  "schemaVersion": 1,
  "source": {
    "commit": "d80bd0c0991dbdf1061d80783c5b7c58ad9db213",
    "generatedAt": "2026-09-21T09:11:33Z",
    "repository": "heimgewebe/systemkatalog"
  }
}
